{
  "workflow_type_versions": {
    "CWL": {
      "workflow_type_version": ["v1.0", "v1.1", "v1.1.0-dev1"]
    },
    "Nextflow": {
      "workflow_type_version": ["v1.0"]
    },
    "Snakemake": {
      "workflow_type_version": ["v1.0"]
    },
    "WDL": {
      "workflow_type_version": ["1.0"]
    }
  },
  "supported_filesystem_protocols": ["http", "https", "file", "s3"],
  "default_workflow_engine_parameters": [],
  "workflow_engine_versions": {
    "cwltool": "1.0.20191225192155",
    "nextflow": "21.01.1-edge",
    "toil (experimental)": "4.1.0",
    "cromwell": "55",
    "snakemake": "v5.32.0",
    "ep3 (experimental)": "v1.0.0"
  },
  "auth_instructions_url": "https://github.com/ddbj/sapporo-service",
  "contact_info_url": "https://github.com/ddbj/sapporo-service",
  "tags": {
    "wes_name": "sapporo"
  }
}
